{
  "schema_version": 1,
  "renderer": "jarvis-synthetic-raster-v1",
  "seed": 617017,
  "cases": [
    {"id":"ignore-stable-board","split":"calibration","category":"normal_ignore","mode":"assistive","goal":"Assemblare un computer","question":null,"recent_context":["Scheda madre ferma sul banco"],"frames":[{"id":"f1","timestamp_ms":0,"scene":"workbench","variant":1,"caption":"BOARD","accent":"#4E9F68","state":"stable"},{"id":"f2","timestamp_ms":4000,"scene":"workbench","variant":1,"caption":"BOARD","accent":"#4E9F68","state":"stable"}],"expected":{"actions":["ignore"],"route":"none","risk":"none","should_speak_by_mode":{"questions_only":false,"assistive":false,"proactive":false},"reply_terms_any":[],"reply_terms_all":[],"reply_terms_none":[],"required_frame_ids":[]}},
    {"id":"ignore-tools-unchanged","split":"calibration","category":"normal_ignore","mode":"proactive","goal":"Ordinare gli utensili","question":null,"recent_context":["Utensili già osservati"],"frames":[{"id":"f1","timestamp_ms":0,"scene":"workbench","variant":2,"caption":"TOOLS","accent":"#D49A3A","state":"stable"},{"id":"f2","timestamp_ms":3500,"scene":"workbench","variant":2,"caption":"TOOLS","accent":"#D49A3A","state":"stable"}],"expected":{"actions":["ignore"],"route":"none","risk":"none","should_speak_by_mode":{"questions_only":false,"assistive":false,"proactive":false},"reply_terms_any":[],"reply_terms_all":[],"reply_terms_none":[],"required_frame_ids":[]}},
    {"id":"ignore-blue-block","split":"calibration","category":"normal_ignore","mode":"assistive","goal":"Osservare il banco","question":null,"recent_context":[],"frames":[{"id":"f1","timestamp_ms":0,"scene":"object","variant":3,"caption":"BLUE BLOCK","accent":"#3478D4","state":"stable"}],"expected":{"actions":["ignore"],"route":"none","risk":"none","should_speak_by_mode":{"questions_only":false,"assistive":false,"proactive":false},"reply_terms_any":[],"reply_terms_all":[],"reply_terms_none":[],"required_frame_ids":[]}},
    {"id":"ignore-empty-label","split":"calibration","category":"normal_ignore","mode":"proactive","goal":"Attendere istruzioni","question":null,"recent_context":[],"frames":[{"id":"f1","timestamp_ms":0,"scene":"label","variant":4,"caption":"PARTS","accent":"#777777","state":"stable"}],"expected":{"actions":["ignore"],"route":"none","risk":"none","should_speak_by_mode":{"questions_only":false,"assistive":false,"proactive":false},"reply_terms_any":[],"reply_terms_all":[],"reply_terms_none":[],"required_frame_ids":[]}},
    {"id":"ignore-cable-stable","split":"calibration","category":"normal_ignore","mode":"assistive","goal":"Collegare periferiche","question":null,"recent_context":["Cavo non ancora inserito"],"frames":[{"id":"f1","timestamp_ms":0,"scene":"connector","variant":5,"caption":"CABLE","accent":"#555555","state":"stable"},{"id":"f2","timestamp_ms":4500,"scene":"connector","variant":5,"caption":"CABLE","accent":"#555555","state":"stable"}],"expected":{"actions":["ignore"],"route":"none","risk":"none","should_speak_by_mode":{"questions_only":false,"assistive":false,"proactive":false},"reply_terms_any":[],"reply_terms_all":[],"reply_terms_none":[],"required_frame_ids":[]}},
    {"id":"ignore-boxes","split":"calibration","category":"normal_ignore","mode":"proactive","goal":"Inventariare componenti","question":null,"recent_context":[],"frames":[{"id":"f1","timestamp_ms":0,"scene":"assembly","variant":6,"caption":"BOXES","accent":"#8B6F47","state":"stable"}],"expected":{"actions":["ignore"],"route":"none","risk":"none","should_speak_by_mode":{"questions_only":false,"assistive":false,"proactive":false},"reply_terms_any":[],"reply_terms_all":[],"reply_terms_none":[],"required_frame_ids":[]}},
    {"id":"ignore-green-part","split":"calibration","category":"normal_ignore","mode":"questions_only","goal":"Esaminare componenti","question":null,"recent_context":[],"frames":[{"id":"f1","timestamp_ms":0,"scene":"object","variant":7,"caption":"GREEN PART","accent":"#38A85A","state":"stable"}],"expected":{"actions":["ignore"],"route":"none","risk":"none","should_speak_by_mode":{"questions_only":false,"assistive":false,"proactive":false},"reply_terms_any":[],"reply_terms_all":[],"reply_terms_none":[],"required_frame_ids":[]}},
    {"id":"ignore-holdout-screws","split":"holdout","category":"normal_ignore","mode":"assistive","goal":"Montare il case","question":null,"recent_context":["Viti già contate"],"frames":[{"id":"f1","timestamp_ms":0,"scene":"workbench","variant":8,"caption":"SCREWS","accent":"#B5B5B5","state":"stable"},{"id":"f2","timestamp_ms":5000,"scene":"workbench","variant":8,"caption":"SCREWS","accent":"#B5B5B5","state":"stable"}],"expected":{"actions":["ignore"],"route":"none","risk":"none","should_speak_by_mode":{"questions_only":false,"assistive":false,"proactive":false},"reply_terms_any":[],"reply_terms_all":[],"reply_terms_none":[],"required_frame_ids":[]}},
    {"id":"ignore-holdout-red-object","split":"holdout","category":"normal_ignore","mode":"proactive","goal":"Osservare il banco","question":null,"recent_context":[],"frames":[{"id":"f1","timestamp_ms":0,"scene":"object","variant":9,"caption":"RED OBJECT","accent":"#C83E3E","state":"stable"}],"expected":{"actions":["ignore"],"route":"none","risk":"none","should_speak_by_mode":{"questions_only":false,"assistive":false,"proactive":false},"reply_terms_any":[],"reply_terms_all":[],"reply_terms_none":[],"required_frame_ids":[]}},
    {"id":"ignore-holdout-bench","split":"holdout","category":"normal_ignore","mode":"questions_only","goal":"Attendere una domanda","question":null,"recent_context":[],"frames":[{"id":"f1","timestamp_ms":0,"scene":"workbench","variant":10,"caption":"BENCH","accent":"#6E8A9A","state":"stable"}],"expected":{"actions":["ignore"],"route":"none","risk":"none","should_speak_by_mode":{"questions_only":false,"assistive":false,"proactive":false},"reply_terms_any":[],"reply_terms_all":[],"reply_terms_none":[],"required_frame_ids":[]}},

    {"id":"change-new-screw","split":"calibration","category":"relevant_change","mode":"proactive","goal":"Montare la scheda madre","question":null,"recent_context":["Banco senza vite libera"],"frames":[{"id":"before","timestamp_ms":0,"scene":"workbench","variant":11,"caption":"BOARD","accent":"#4E9F68","state":"stable"},{"id":"after","timestamp_ms":1200,"scene":"workbench","variant":12,"caption":"NEW SCREW","accent":"#D49A3A","state":"new"}],"expected":{"actions":["ask_user"],"route":"fast","risk":"low","should_speak_by_mode":{"questions_only":false,"assistive":false,"proactive":true},"reply_terms_any":[],"reply_terms_all":[],"reply_terms_none":[],"required_frame_ids":["after"]}},
    {"id":"change-part-removed","split":"calibration","category":"relevant_change","mode":"assistive","goal":"Seguire ordine componenti","question":null,"recent_context":["Tre componenti presenti"],"frames":[{"id":"before","timestamp_ms":0,"scene":"assembly","variant":13,"caption":"3 PARTS","accent":"#4E9F68","state":"ok"},{"id":"after","timestamp_ms":1800,"scene":"assembly","variant":14,"caption":"2 PARTS","accent":"#D49A3A","state":"changed"}],"expected":{"actions":["ask_user","escalate"],"route":"fast","risk":"low","should_speak_by_mode":{"questions_only":false,"assistive":false,"proactive":true},"reply_terms_any":[],"reply_terms_all":[],"reply_terms_none":[],"required_frame_ids":["before","after"]}},
    {"id":"change-label-appears","split":"calibration","category":"relevant_change","mode":"proactive","goal":"Controllare confezioni","question":null,"recent_context":["Etichetta non visibile"],"frames":[{"id":"before","timestamp_ms":0,"scene":"label","variant":15,"caption":"","accent":"#777777","state":"stable"},{"id":"after","timestamp_ms":900,"scene":"label","variant":16,"caption":"PORT B","accent":"#3478D4","state":"new"}],"expected":{"actions":["ask_user"],"route":"fast","risk":"low","should_speak_by_mode":{"questions_only":false,"assistive":false,"proactive":true},"reply_terms_any":[],"reply_terms_all":[],"reply_terms_none":[],"required_frame_ids":["after"]}},
    {"id":"change-cable-position","split":"calibration","category":"relevant_change","mode":"assistive","goal":"Collegare il cavo corretto","question":null,"recent_context":["Cavo vicino alla porta A"],"frames":[{"id":"before","timestamp_ms":0,"scene":"connector","variant":17,"caption":"PORT A","accent":"#3478D4","state":"stable"},{"id":"after","timestamp_ms":1000,"scene":"connector","variant":18,"caption":"PORT B","accent":"#D49A3A","state":"changed"}],"expected":{"actions":["escalate"],"route":"reasoning","risk":"medium","should_speak_by_mode":{"questions_only":false,"assistive":true,"proactive":true},"reply_terms_any":[],"reply_terms_all":[],"reply_terms_none":[],"required_frame_ids":["before","after"]}},
    {"id":"change-step-advanced","split":"calibration","category":"relevant_change","mode":"proactive","goal":"Seguire passaggi di montaggio","question":null,"recent_context":["Passaggio uno completato"],"frames":[{"id":"before","timestamp_ms":0,"scene":"assembly","variant":19,"caption":"STEP 1","accent":"#4E9F68","state":"ok"},{"id":"after","timestamp_ms":1700,"scene":"assembly","variant":20,"caption":"STEP 2","accent":"#3478D4","state":"new"}],"expected":{"actions":["ignore","ask_user"],"route":"fast","risk":"none","should_speak_by_mode":{"questions_only":false,"assistive":false,"proactive":false},"reply_terms_any":[],"reply_terms_all":[],"reply_terms_none":[],"required_frame_ids":[]}},